id,title,duration,releaseDate,artistIDs,albumID,genreIDs,awardIDs
song_444,User-centric exuding moratorium Song 444,322,2008-07-30,['artist_43'],album_8,['genre_9'],[]
song_445,Switchable dedicated concept Song 445,180,2015-02-19,"['artist_87', 'artist_84']",,['genre_0'],[]
song_446,Public-key impactful circuit Song 446,375,2001-06-23,"['artist_51', 'artist_90']",album_17,['genre_8'],[]
song_447,Upgradable directional capacity Song 447,167,2018-07-12,['artist_34'],,['genre_7'],[]
song_448,Up-sized exuding customer loyalty Song 448,272,2024-06-18,"['artist_7', 'artist_40']",album_68,['genre_13'],[]
song_449,Re-contextualized local conglomeration Song 449,152,2018-04-02,"['artist_38', 'artist_57']",,['genre_0'],[]
song_450,Re-contextualized background architecture Song 450,295,2013-02-18,['artist_16'],,['genre_1'],[]
song_451,Virtual eco-centric conglomeration Song 451,346,1987-03-25,['artist_64'],album_89,"['genre_0', 'genre_14']",[]
song_452,Realigned asynchronous capacity Song 452,349,2020-02-06,['artist_28'],album_82,['genre_6'],[]
song_453,Grass-roots value-added synergy Song 453,232,2016-08-15,"['artist_6', 'artist_83']",,['genre_0'],[]
song_454,Front-line object-oriented conglomeration Song 454,311,2002-09-23,"['artist_70', 'artist_57']",album_92,"['genre_2', 'genre_12']",[]
song_455,Open-architected hybrid paradigm Song 455,208,2010-01-08,"['artist_88', 'artist_47']",album_97,['genre_6'],[]
song_456,Adaptive bi-directional analyzer Song 456,369,2021-05-12,"['artist_1', 'artist_34']",album_33,['genre_1'],[]
song_457,User-friendly high-level policy Song 457,336,2002-09-01,['artist_10'],album_44,['genre_12'],[]
song_458,Adaptive systemic support Song 458,206,2013-06-28,"['artist_30', 'artist_8']",album_65,"['genre_9', 'genre_1']",['award_8']
song_459,Optional tertiary application Song 459,133,1997-02-26,['artist_89'],,"['genre_4', 'genre_6']",[]
song_460,Cross-platform non-volatile hardware Song 460,217,2000-02-13,['artist_99'],album_69,"['genre_12', 'genre_3']",[]
song_461,Quality-focused well-modulated knowledgebase Song 461,351,2008-09-07,['artist_47'],album_63,['genre_4'],[]
song_462,Operative 24hour moderator Song 462,285,1983-04-13,['artist_43'],album_95,"['genre_4', 'genre_6']",[]
song_463,Object-based bandwidth-monitored project Song 463,152,1999-10-01,['artist_25'],,"['genre_7', 'genre_14']",[]
song_464,Exclusive 24/7 orchestration Song 464,359,2017-11-12,['artist_96'],album_65,"['genre_9', 'genre_1']",['award_6']
song_465,Enterprise-wide dedicated moderator Song 465,236,1995-07-10,"['artist_11', 'artist_48']",album_19,"['genre_8', 'genre_3']",[]
song_466,Balanced static capability Song 466,224,2013-01-19,['artist_89'],album_51,"['genre_11', 'genre_13']",[]
song_467,Networked coherent model Song 467,391,2013-01-28,['artist_76'],,"['genre_8', 'genre_1']",[]
song_468,Implemented zero tolerance challenge Song 468,190,2016-12-08,['artist_46'],album_51,"['genre_13', 'genre_11']",['award_20']
song_469,Exclusive exuding matrix Song 469,241,2020-11-08,"['artist_44', 'artist_17']",album_82,['genre_6'],[]
song_470,Right-sized content-based throughput Song 470,310,2022-03-12,['artist_21'],album_1,"['genre_14', 'genre_11']",[]
song_471,Compatible object-oriented encryption Song 471,221,1993-12-30,['artist_2'],album_43,['genre_10'],[]
song_472,User-friendly transitional capability Song 472,402,1985-08-20,"['artist_64', 'artist_89']",album_79,['genre_11'],[]
song_473,Monitored fault-tolerant algorithm Song 473,287,2002-02-07,['artist_7'],album_65,['genre_1'],[]
song_474,Programmable non-volatile projection Song 474,175,2003-11-25,['artist_86'],album_19,"['genre_8', 'genre_3']",[]
song_475,Team-oriented global encoding Song 475,283,1985-05-31,"['artist_77', 'artist_87']",album_73,['genre_14'],[]
song_476,Devolved next generation challenge Song 476,153,2008-02-21,['artist_33'],album_31,"['genre_0', 'genre_1']",[]
song_477,Self-enabling dynamic project Song 477,271,1984-08-16,['artist_5'],album_65,['genre_9'],[]
song_478,Multi-layered real-time core Song 478,205,2007-07-20,['artist_26'],album_80,['genre_9'],[]
song_479,Upgradable eco-centric approach Song 479,412,1997-01-24,['artist_86'],album_71,"['genre_0', 'genre_11']",[]
song_480,Function-based grid-enabled portal Song 480,356,2023-12-09,['artist_2'],album_9,['genre_13'],[]
song_481,Business-focused 6thgeneration archive Song 481,120,2000-07-28,['artist_0'],album_17,['genre_8'],[]
song_482,Phased web-enabled process improvement Song 482,146,1988-02-06,['artist_75'],album_31,['genre_0'],[]
song_483,Multi-tiered attitude-oriented moderator Song 483,133,2010-03-07,['artist_73'],album_45,"['genre_6', 'genre_2']",[]
song_484,Multi-channeled discrete software Song 484,390,2013-03-04,['artist_1'],,"['genre_2', 'genre_10']",[]
song_485,Sharable attitude-oriented hub Song 485,322,2015-02-18,['artist_81'],,['genre_7'],[]
song_486,Face-to-face cohesive portal Song 486,199,2013-05-10,"['artist_57', 'artist_39']",album_75,"['genre_7', 'genre_9']",[]
song_487,Down-sized homogeneous collaboration Song 487,180,2022-10-04,['artist_57'],album_80,['genre_9'],[]
song_488,Expanded neutral hub Song 488,405,1996-08-22,['artist_61'],album_53,"['genre_12', 'genre_10']",[]
song_489,Down-sized zero tolerance ability Song 489,130,1987-10-08,"['artist_15', 'artist_56']",album_56,['genre_13'],[]
song_490,Extended scalable groupware Song 490,269,2002-08-02,['artist_13'],album_20,['genre_14'],[]
song_491,Assimilated next generation workforce Song 491,130,1989-09-11,"['artist_86', 'artist_73']",,['genre_5'],[]
song_492,Open-source zero-defect adapter Song 492,137,1985-07-27,"['artist_89', 'artist_38']",album_50,['genre_1'],[]
song_493,Digitized explicit utilization Song 493,266,2013-09-29,"['artist_37', 'artist_35']",album_85,['genre_12'],['award_9']
song_494,Digitized background parallelism Song 494,130,1991-09-18,['artist_28'],album_69,"['genre_12', 'genre_3']",[]
song_495,Future-proofed systemic initiative Song 495,290,2016-02-01,['artist_8'],album_53,"['genre_12', 'genre_10']",[]
song_496,Devolved content-based function Song 496,288,1998-02-22,"['artist_30', 'artist_88']",album_54,['genre_3'],[]
song_497,Down-sized client-driven knowledgebase Song 497,386,1989-10-01,"['artist_46', 'artist_62']",album_43,['genre_10'],[]
song_498,Progressive demand-driven functionalities Song 498,398,1983-03-04,"['artist_20', 'artist_63']",album_24,['genre_0'],[]
song_499,Reverse-engineered bi-directional contingency Song 499,348,1984-10-08,['artist_81'],album_0,['genre_10'],[]
song_500,Business-focused optimal budgetary management Song 500,240,1998-10-25,"['artist_99', 'artist_91']",album_3,['genre_1'],[]
song_501,Re-contextualized grid-enabled superstructure Song 501,175,2000-11-11,['artist_1'],album_86,"['genre_1', 'genre_2']",['award_8']
song_502,Down-sized heuristic functionalities Song 502,374,1990-02-21,"['artist_47', 'artist_55']",album_98,['genre_4'],[]
song_503,Customizable static core Song 503,197,2014-10-09,"['artist_83', 'artist_90']",album_80,['genre_9'],[]
song_504,Fully-configurable non-volatile complexity Song 504,394,1983-01-28,"['artist_82', 'artist_44']",album_7,['genre_0'],[]
song_505,Front-line hybrid framework Song 505,174,2005-09-30,['artist_62'],album_20,['genre_14'],[]
song_506,Implemented needs-based customer loyalty Song 506,370,2011-04-17,"['artist_38', 'artist_71']",album_48,['genre_0'],[]
song_507,Implemented didactic system engine Song 507,258,2024-06-21,"['artist_92', 'artist_45']",album_14,['genre_4'],[]
song_508,Team-oriented clear-thinking adapter Song 508,293,1995-12-11,"['artist_88', 'artist_46']",album_91,['genre_13'],[]
song_509,Function-based bottom-line customer loyalty Song 509,366,2011-12-01,['artist_4'],album_31,"['genre_0', 'genre_1']",[]
song_510,Proactive interactive Graphic Interface Song 510,124,2016-09-16,"['artist_38', 'artist_35']",album_48,"['genre_0', 'genre_7']",[]
song_511,Diverse dynamic hardware Song 511,282,1994-02-17,['artist_70'],album_4,['genre_4'],['award_1']
song_512,Reactive 5thgeneration time-frame Song 512,359,2020-11-09,"['artist_98', 'artist_49']",album_26,['genre_7'],[]
song_513,Mandatory optimizing approach Song 513,224,1987-09-15,"['artist_85', 'artist_41']",album_60,['genre_14'],[]
song_514,Multi-tiered 4thgeneration software Song 514,365,2004-05-17,['artist_58'],album_37,['genre_1'],[]
song_515,Adaptive motivating middleware Song 515,310,2013-10-05,['artist_31'],album_57,['genre_13'],[]
song_516,Versatile holistic orchestration Song 516,324,2006-09-15,['artist_68'],album_43,['genre_10'],[]
song_517,Secured bifurcated infrastructure Song 517,307,2008-06-12,['artist_32'],album_27,"['genre_12', 'genre_6']",[]
song_518,Mandatory 6thgeneration moderator Song 518,189,2007-12-29,['artist_76'],album_46,"['genre_11', 'genre_0']",['award_24']
song_519,Down-sized full-range protocol Song 519,376,2011-01-12,"['artist_19', 'artist_49']",album_14,"['genre_0', 'genre_4']",[]
song_520,Intuitive asymmetric intranet Song 520,201,1988-02-29,"['artist_73', 'artist_15']",album_19,"['genre_3', 'genre_8']",[]
song_521,Innovative scalable product Song 521,263,1988-03-10,['artist_62'],,['genre_2'],[]
song_522,Re-engineered optimizing utilization Song 522,191,2001-12-14,['artist_37'],album_56,['genre_13'],[]
song_523,Distributed web-enabled encryption Song 523,164,2010-09-24,['artist_61'],album_5,['genre_8'],[]
song_524,Phased solution-oriented challenge Song 524,340,2020-10-13,['artist_12'],album_64,['genre_9'],[]
song_525,Multi-tiered foreground capability Song 525,401,2019-02-28,"['artist_86', 'artist_71']",album_39,"['genre_11', 'genre_12']",[]
song_526,Innovative secondary leverage Song 526,206,2019-05-10,"['artist_8', 'artist_11']",album_2,['genre_8'],[]
song_527,Operative optimal secured line Song 527,305,1983-10-20,['artist_7'],album_44,['genre_12'],[]
song_528,Fully-configurable intangible encoding Song 528,296,2009-02-07,"['artist_28', 'artist_61']",,['genre_3'],[]
song_529,Down-sized systematic migration Song 529,138,2006-07-02,"['artist_92', 'artist_26']",album_50,"['genre_0', 'genre_1']",[]
song_530,Multi-tiered didactic website Song 530,368,1985-06-24,['artist_36'],album_5,['genre_8'],[]
song_531,Team-oriented background productivity Song 531,347,2007-04-19,"['artist_5', 'artist_18']",album_12,['genre_0'],[]
song_532,Public-key grid-enabled structure Song 532,239,2011-04-03,"['artist_3', 'artist_82']",album_39,['genre_11'],[]
song_533,Right-sized contextually-based firmware Song 533,371,2021-02-01,['artist_26'],album_46,['genre_0'],[]
song_534,Organic mobile array Song 534,391,1995-03-18,"['artist_68', 'artist_40']",album_28,['genre_13'],[]
song_535,Ameliorated asymmetric application Song 535,274,2017-07-16,['artist_17'],album_95,['genre_6'],[]
song_536,Face-to-face heuristic projection Song 536,330,2001-04-15,"['artist_99', 'artist_95']",album_18,['genre_2'],['award_3']
song_537,Triple-buffered context-sensitive moratorium Song 537,277,2015-01-08,"['artist_40', 'artist_45']",album_84,['genre_12'],[]
song_538,Centralized actuating database Song 538,153,2006-07-26,['artist_77'],album_95,"['genre_6', 'genre_4']",[]
song_539,Multi-lateral even-keeled function Song 539,287,1986-09-01,['artist_56'],album_73,['genre_14'],[]
song_540,Synergistic exuding functionalities Song 540,302,2001-03-08,['artist_20'],album_83,['genre_9'],[]
song_541,Centralized heuristic protocol Song 541,355,2019-11-09,"['artist_56', 'artist_19']",album_97,['genre_6'],['award_24']
song_542,Cross-group web-enabled interface Song 542,327,1992-04-04,['artist_25'],,['genre_14'],[]
song_543,Vision-oriented scalable concept Song 543,396,2003-12-11,['artist_49'],,"['genre_10', 'genre_8']",[]
song_544,Extended 4thgeneration task-force Song 544,201,2022-08-26,"['artist_19', 'artist_84']",album_66,['genre_4'],[]
song_545,Phased executive time-frame Song 545,161,2024-11-24,['artist_86'],album_11,['genre_6'],[]
song_546,Open-source responsive frame Song 546,255,2009-07-07,['artist_51'],album_85,['genre_12'],['award_20']
song_547,Fully-configurable content-based website Song 547,152,1992-03-04,['artist_69'],album_73,['genre_14'],[]
song_548,Synergistic directional challenge Song 548,160,1996-06-29,"['artist_1', 'artist_29']",album_81,['genre_11'],[]
song_549,Quality-focused zero tolerance algorithm Song 549,291,2023-05-17,"['artist_11', 'artist_64']",album_76,"['genre_0', 'genre_5']",[]
song_550,Synchronized encompassing task-force Song 550,379,1987-04-18,['artist_45'],album_53,['genre_12'],[]
song_551,Total holistic matrix Song 551,315,1989-03-05,"['artist_5', 'artist_99']",album_55,['genre_4'],[]
song_552,Programmable radical methodology Song 552,290,1984-09-11,"['artist_63', 'artist_6']",album_64,['genre_9'],[]
song_553,Total multi-state neural-net Song 553,390,1988-09-25,"['artist_65', 'artist_24']",album_90,['genre_10'],[]
song_554,Customer-focused multimedia hierarchy Song 554,408,2014-10-16,"['artist_80', 'artist_38']",album_84,['genre_12'],[]
song_555,Multi-lateral multimedia orchestration Song 555,241,1996-11-21,['artist_13'],,"['genre_7', 'genre_5']",['award_29']
song_556,Networked zero tolerance throughput Song 556,214,2001-08-29,['artist_79'],album_95,"['genre_6', 'genre_4']",[]
song_557,Face-to-face didactic knowledgebase Song 557,224,1984-01-10,"['artist_61', 'artist_20']",album_92,"['genre_12', 'genre_2']",[]
song_558,Exclusive real-time model Song 558,194,1997-10-10,['artist_93'],album_67,['genre_8'],[]
song_559,Re-contextualized neutral architecture Song 559,349,2013-06-10,"['artist_22', 'artist_91']",album_61,['genre_0'],[]
song_560,Business-focused needs-based task-force Song 560,354,2017-05-09,['artist_43'],album_94,['genre_3'],[]
song_561,Expanded impactful access Song 561,226,2001-01-02,['artist_45'],,['genre_5'],[]
song_562,Automated dedicated framework Song 562,308,1985-10-04,"['artist_89', 'artist_38']",album_99,['genre_13'],[]
song_563,Profit-focused systematic attitude Song 563,377,2023-08-06,"['artist_34', 'artist_69']",album_1,"['genre_14', 'genre_11']",['award_0']
song_564,Function-based systematic Local Area Network Song 564,299,2020-08-25,"['artist_18', 'artist_71']",album_44,['genre_12'],[]
song_565,Face-to-face dedicated superstructure Song 565,228,1993-09-09,['artist_25'],album_55,['genre_4'],[]
song_566,Stand-alone actuating open architecture Song 566,293,1994-06-29,"['artist_50', 'artist_98']",,"['genre_6', 'genre_1']",[]
song_567,Face-to-face encompassing artificial intelligence Song 567,334,2021-10-28,"['artist_51', 'artist_99']",,['genre_8'],['award_21']
song_568,Cross-group fresh-thinking capability Song 568,411,1983-07-13,['artist_83'],album_95,"['genre_6', 'genre_4']",[]
song_569,Horizontal leadingedge Graphical User Interface Song 569,256,2009-02-21,"['artist_22', 'artist_52']",album_63,['genre_4'],[]
song_570,Cross-group dynamic Internet solution Song 570,203,2005-02-26,"['artist_37', 'artist_53']",album_26,['genre_7'],[]
song_571,Cloned maximized installation Song 571,388,1991-06-24,['artist_54'],,"['genre_1', 'genre_11']",[]
song_572,Horizontal system-worthy framework Song 572,406,2009-01-14,"['artist_67', 'artist_33']",album_46,['genre_11'],[]
song_573,Enhanced leadingedge encoding Song 573,313,2017-08-24,['artist_22'],album_18,['genre_2'],[]
song_574,Versatile neutral monitoring Song 574,378,2003-07-14,['artist_50'],album_53,"['genre_12', 'genre_10']",[]
song_575,Digitized context-sensitive process improvement Song 575,322,1992-11-12,['artist_49'],album_74,['genre_7'],[]
song_576,Devolved responsive time-frame Song 576,260,2012-11-25,"['artist_23', 'artist_24']",album_7,['genre_0'],[]
song_577,Versatile well-modulated migration Song 577,315,2021-03-04,['artist_31'],album_70,"['genre_13', 'genre_10']",[]
song_578,Innovative client-driven encoding Song 578,404,2008-07-16,['artist_31'],album_36,['genre_5'],[]
song_579,Managed directional strategy Song 579,303,2002-01-13,['artist_71'],,"['genre_2', 'genre_6']",[]
song_580,Configurable full-range leverage Song 580,395,1991-10-02,"['artist_27', 'artist_69']",album_60,['genre_14'],[]
song_581,Stand-alone multi-tasking hub Song 581,216,2006-12-25,['artist_39'],album_57,['genre_13'],[]
song_582,Switchable upward-trending algorithm Song 582,145,2008-06-02,['artist_8'],album_71,"['genre_11', 'genre_0']",[]
song_583,Reduced national monitoring Song 583,339,2021-10-10,"['artist_36', 'artist_77']",album_37,['genre_1'],['award_5']
song_584,Optimized analyzing leverage Song 584,180,2002-02-12,['artist_57'],album_25,"['genre_5', 'genre_13']",[]
song_585,Decentralized actuating alliance Song 585,201,1997-07-08,['artist_49'],album_42,['genre_10'],[]
song_586,Front-line global synergy Song 586,135,2023-02-14,['artist_14'],album_31,"['genre_1', 'genre_0']",[]
song_587,Proactive 4thgeneration interface Song 587,142,2015-06-23,['artist_89'],album_22,['genre_12'],[]
song_588,Programmable bottom-line time-frame Song 588,197,2023-06-20,"['artist_93', 'artist_81']",album_83,['genre_9'],[]
song_589,Stand-alone tangible encryption Song 589,302,1985-11-17,"['artist_84', 'artist_34']",album_26,['genre_7'],[]
song_590,Upgradable web-enabled utilization Song 590,282,2008-08-27,['artist_84'],album_8,['genre_9'],[]
song_591,Stand-alone methodical Graphic Interface Song 591,219,1990-05-28,"['artist_46', 'artist_93']",album_42,['genre_10'],[]
song_592,Operative full-range solution Song 592,410,1996-06-06,"['artist_46', 'artist_17']",album_57,['genre_13'],[]
song_593,Proactive demand-driven forecast Song 593,153,1987-09-24,['artist_10'],album_58,['genre_9'],[]
song_594,Seamless 6thgeneration product Song 594,372,1992-01-16,['artist_49'],album_71,['genre_0'],[]
song_595,Distributed multi-state utilization Song 595,368,2012-02-06,"['artist_40', 'artist_99']",album_97,['genre_6'],[]
song_596,Triple-buffered methodical algorithm Song 596,308,2001-01-24,"['artist_86', 'artist_47']",,['genre_6'],[]
song_597,Triple-buffered grid-enabled moratorium Song 597,260,1999-03-09,['artist_93'],album_58,['genre_9'],[]
song_598,Team-oriented client-driven support Song 598,160,2022-11-23,"['artist_95', 'artist_59']",,['genre_6'],[]
song_599,Pre-emptive secondary project Song 599,326,2024-10-22,"['artist_17', 'artist_68']",album_94,['genre_3'],[]
