id,payerName,payerType,contactInfo
payer_0,Hall and Sons Insurance,Medicaid,918-521-7309x501
payer_1,"Tyler, Whitney and Olson Insurance",Private,209-774-4929x852
payer_2,Hooper-Collins Insurance,Medicare,422.317.9106x937
payer_3,"Ramirez, Kirk and Simmons Insurance",Medicaid,776.214.3862
payer_4,"Sanchez, Forbes and Evans Insurance",Medicare,001-243-729-2202x22805
payer_5,Matthews Group Insurance,Medicare,(521)773-0178x043
payer_6,"Gutierrez, Moody and Mendez Insurance",Medicaid,507.811.8443x20312
payer_7,Alvarado LLC Insurance,Private,(656)342-8656x52029
